{
  "active_routes": [
    "ER-001"
  ],
  "budget_authorization": 1,
  "budget_used": 0,
  "coverage_obligations": [
    "SRP-DEMO-001"
  ],
  "created_at": "2026-09-04T17:32:28.350253Z",
  "portfolio_id": "SP-001",
  "schema_version": "3.0-post-p1p5-a",
  "uncovered_obligations": [
    "SRP-DEMO-001"
  ]
}
