{
  "active_routes": [
    "ER-902"
  ],
  "budget_authorization": 1,
  "budget_used": 0,
  "coverage_obligations": [
    "MR-CQC-476202de4fdb"
  ],
  "created_at": "2026-09-05T21:52:36.003198Z",
  "portfolio_id": "SP-902",
  "schema_version": "3.0-post-p1p5-a",
  "uncovered_obligations": [
    "MR-CQC-476202de4fdb"
  ]
}
