{
  "active_routes": [
    "ER-901"
  ],
  "budget_authorization": 1,
  "budget_used": 1,
  "coverage_obligations": [
    "MR-CQC-65f83b6062a3"
  ],
  "created_at": "2026-09-06T00:00:00Z",
  "portfolio_id": "SP-901",
  "schema_version": "3.0-post-p1p5-a",
  "uncovered_obligations": []
}
